Variable name,Unit,Description (EN),Size,Type,Default value,Minimum value,Maximum value,,Package,Inherit,Methods,Constant Name,Constant Value,Class description
loss_list,,Internal list of loss data,,[SciDataTool.Classes.DataND.DataND],None,,,,Output,,get_loss,VERSION,1,Gather the loss module outputs
meshsol_dict,,Internal dict of loss meshsolutions,,{MeshSolution},None,,,,,,get_loss_density_ag,,,
loss_index,,Internal dict to index losses,,dict,{},,,,,,get_loss_dist,,,
logger_name,-,Name of the logger to use,0,str,Pyleecan.Loss,,,,,,get_loss_group,,,
axes_dict,,Dict containing axes data used for Magnetics,,{SciDataTool.Classes.DataND.Data},None,,,,,,get_loss_overall,,,
loss_dict,,Dict containing loss data computed by the loss module,,dict,None,,,,,,get_loss_scalar,,,
,,,,,,,,,,,store,,,
